{
  "$schema": "https://ion-drive.dev/schemas/registry-block.v1.json",
  "schemaVersion": 1,
  "name": "communications",
  "title": "Communications",
  "description": "Email templates and a notification log for outbound messaging.",
  "categories": [
    "messaging",
    "notifications"
  ],
  "repository": "https://github.com/jaredgrabill/ion-drive-blocks",
  "latest": "0.1.0",
  "versions": {
    "0.1.0": {
      "artifactUrl": "../../communications/dist/0.1.0/block.json",
      "digest": "sha256:65a02647b473b1d8e87c79eaf5ea226fabefece2b14a0ea10de9f9241b1986be",
      "size": 3763,
      "publishedAt": "2026-07-08T22:38:16Z",
      "dependencies": {},
      "requires": {
        "core": ">=0.2.0 <1.0.0"
      },
      "status": "active"
    }
  },
  "advisories": []
}
