{
  "$schema": "https://iondrive.dev/schemas/registry-block.v1.json",
  "schemaVersion": 1,
  "name": "invoicing",
  "title": "Invoicing",
  "description": "Invoices, line items, and payments — billing on top of your CRM.",
  "categories": [
    "finance",
    "billing"
  ],
  "repository": "https://github.com/jaredgrabill/ion-drive-blocks",
  "latest": "0.1.0",
  "versions": {
    "0.1.0": {
      "artifactUrl": "../../invoicing/dist/0.1.0/block.json",
      "digest": "sha256:e46915e2dd7a05de142484ca0c0c21cf1f73d5db2f9ed89904c904c203fa8bd3",
      "size": 15846,
      "publishedAt": "2026-07-09T03:10:46Z",
      "dependencies": {
        "crm": "^0.2.0"
      },
      "requires": {
        "core": ">=0.2.0 <1.0.0"
      },
      "status": "active"
    }
  },
  "advisories": []
}
