{
  "$schema": "https://ion-drive.dev/schemas/registry-block.v1.json",
  "schemaVersion": 1,
  "name": "catalog",
  "title": "Product Catalog",
  "description": "Products with prices and lightweight stock tracking — pick a product and the price flows onto the invoice.",
  "categories": [
    "commerce",
    "inventory"
  ],
  "repository": "https://github.com/jaredgrabill/ion-drive-blocks",
  "latest": "0.1.0",
  "versions": {
    "0.1.0": {
      "artifactUrl": "../../catalog/dist/0.1.0/block.json",
      "digest": "sha256:257f9ece566ed13c8bae3c84b5e5ca8de8ff08b4004c50b7bc76b15ed1c6c12f",
      "size": 22761,
      "publishedAt": "2026-07-08T22:38:16Z",
      "dependencies": {
        "invoicing": "^0.1.0"
      },
      "requires": {
        "core": ">=0.2.0 <1.0.0"
      },
      "status": "active"
    }
  },
  "advisories": []
}
